{
  "conditionProfiles": {
    "neutral": {
      "abundanceTurnoverProfile": {
        "0.0.1.1": 0.01694915254237288,
        "1.0.1.0": 0.2272727272727274,
        "1.0.1.1": 1.023984923122854,
        "1.0.1.2": 0.5741595441595441,
        "1.0.2.1": 0.13333333333333333,
        "1.0.2.2": 0.5791491921926706,
        "1.1.0.1": 0.9735230266809214,
        "1.1.0.2": 0.10152676889965026,
        "1.1.1.0": 0.3211853440941691,
        "1.1.1.1": 4.668062513946005,
        "1.1.1.2": 2.042468400089517,
        "1.1.2.0": 0.047089947089947085,
        "1.1.2.1": 2.5678052640322164,
        "1.1.2.2": 1.017055543120022,
        "1.2.1.0": 0.03518518518518518,
        "1.2.1.1": 0.7302971630030033,
        "1.2.1.2": 0.27790915114943027,
        "1.2.1.3": 0.018518518518518517,
        "1.2.2.1": 0.44861434861434857,
        "1.2.2.2": 0.19147186147186146,
        "2.0.1.1": 0.23143297380585517,
        "2.0.2.1": 0.7295152995152996,
        "2.1.0.0": 0.08571428571428572,
        "2.1.0.1": 0.22139433551198257,
        "2.1.0.2": 1.4782614616205945,
        "2.1.1.0": 0.7977978042808678,
        "2.1.1.1": 9.855174445956965,
        "2.1.1.2": 4.935870598192574,
        "2.1.1.3": 0.052941176470588235,
        "2.1.2.0": 0.6325631436520728,
        "2.1.2.1": 3.999239983269733,
        "2.1.2.2": 0.7621133417320491,
        "2.2.0.2": 0.07142857142857142,
        "2.2.1.0": 0.01694915254237288,
        "2.2.1.1": 1.5396064322977108,
        "2.2.1.2": 0.26663535338983135,
        "2.2.2.1": 0.8327211972617862,
        "2.2.2.2": 0.4061959935489346,
        "3.1.1.1": 0.01639344262295082
      },
      "cellFluxProfile": {
        "0.0.1.1": 0.0,
        "1.0.1.0": 0.014228614598022458,
        "1.0.1.1": 0.03718008521243309,
        "1.0.1.2": 0.014272302554788415,
        "1.0.2.1": 0.0,
        "1.0.2.2": 0.03240123126222025,
        "1.1.0.1": 0.048141027611741966,
        "1.1.0.2": 0.0,
        "1.1.1.0": 0.007640585064555259,
        "1.1.1.1": 0.16780526065352563,
        "1.1.1.2": 0.0677127407942229,
        "1.1.2.0": 0.0,
        "1.1.2.1": 0.13622278450077338,
        "1.1.2.2": 0.024226284654538764,
        "1.2.1.0": 0.0,
        "1.2.1.1": 0.02271355499956605,
        "1.2.1.2": 0.009189481698908951,
        "1.2.1.3": 0.0,
        "1.2.2.1": 0.0070618914227639235,
        "1.2.2.2": 0.0,
        "2.0.1.1": 0.009367514518362777,
        "2.0.2.1": 0.037417559017199384,
        "2.1.0.0": 0.0,
        "2.1.0.1": 0.0,
        "2.1.0.2": 0.07220259255707034,
        "2.1.1.0": 0.0417315393395123,
        "2.1.1.1": 0.3735390421353303,
        "2.1.1.2": 0.1593029357474267,
        "2.1.1.3": 0.0,
        "2.1.2.0": 0.032616972304970966,
        "2.1.2.1": 0.17870535979567903,
        "2.1.2.2": 0.03582646377650256,
        "2.2.0.2": 0.0,
        "2.2.1.0": 0.0,
        "2.2.1.1": 0.04553218766661734,
        "2.2.1.2": 0.004310696458257362,
        "2.2.2.1": 0.08459624515325505,
        "2.2.2.2": 0.003245262301306802,
        "3.1.1.1": 0.0
      },
      "edgeFluxProfile": {
        "0.0.1.1->0.0.1.1": 0.0,
        "1.0.1.0->1.0.1.0": 0.0062896212751685195,
        "1.0.1.1->1.0.1.0": 0.00793899332285394,
        "1.0.1.1->1.0.1.1": 0.030767558548007105,
        "1.0.1.2->1.0.1.2": 0.014272302554788415,
        "1.0.2.1->1.0.2.1": 0.0,
        "1.0.2.1->2.0.2.1": 0.003632183304760607,
        "1.0.2.2->1.0.2.2": 0.03240123126222025,
        "1.1.0.1->1.1.0.1": 0.04066403466467555,
        "1.1.0.2->1.1.0.2": 0.0,
        "1.1.1.0->1.1.1.0": 0.007640585064555259,
        "1.1.1.0->2.1.1.0": 0.001304912952176453,
        "1.1.1.1->1.0.1.1": 0.006412526664425984,
        "1.1.1.1->1.1.1.0": 0.005294240628067054,
        "1.1.1.1->1.1.1.1": 0.14479249066282812,
        "1.1.1.1->1.2.1.1": 0.007006491876843877,
        "1.1.1.2->1.1.1.2": 0.06394067540844725,
        "1.1.1.2->2.1.1.2": 0.006602543457250286,
        "1.1.2.0->1.1.2.0": 0.0,
        "1.1.2.1->1.1.1.1": 0.013266721882665485,
        "1.1.2.1->1.1.2.1": 0.11297526441513356,
        "1.1.2.1->1.1.2.2": 0.009980798202974319,
        "1.1.2.2->1.1.2.2": 0.024226284654538764,
        "1.2.1.0->1.2.1.0": 0.0,
        "1.2.1.1->1.1.1.1": 0.011145347077752473,
        "1.2.1.1->1.2.1.1": 0.0020202168624918262,
        "1.2.1.1->2.2.1.1": 0.002541499182477871,
        "1.2.1.2->1.2.1.2": 0.006892062451761424,
        "1.2.1.2->2.1.1.2": 0.003772065385775646,
        "1.2.1.3->1.2.1.3": 0.0,
        "1.2.2.1->1.2.2.1": 0.0070618914227639235,
        "1.2.2.1->2.2.1.1": 0.0015633916035329085,
        "1.2.2.2->1.2.1.2": 0.002297419247147528,
        "1.2.2.2->1.2.2.2": 0.0,
        "2.0.1.1->2.0.1.1": 0.009367514518362777,
        "2.0.1.1->2.1.1.1": 0.005313689786815781,
        "2.0.2.1->2.0.2.1": 0.025232476416561418,
        "2.1.0.0->2.1.0.0": 0.0,
        "2.1.0.1->1.1.0.1": 0.007476992947066408,
        "2.1.0.1->2.1.0.1": 0.0,
        "2.1.0.2->2.1.0.2": 0.06403345260129112,
        "2.1.0.2->2.1.1.2": 0.008169139955779215,
        "2.1.1.0->2.1.1.0": 0.040426626387335844,
        "2.1.1.0->2.1.1.1": 0.0028644545757352154,
        "2.1.1.1->1.1.1.1": 0.017718529362630478,
        "2.1.1.1->1.1.1.2": 0.001789160374853408,
        "2.1.1.1->2.0.1.1": 0.007071709416233753,
        "2.1.1.1->2.1.1.0": 0.025689016634422995,
        "2.1.1.1->2.1.1.1": 0.3013826376183361,
        "2.1.1.1->2.1.1.2": 0.0041932057632282655,
        "2.1.1.1->2.1.2.1": 0.026599548776201062,
        "2.1.1.2->2.1.0.2": 0.025134863859788612,
        "2.1.1.2->2.1.1.1": 0.00689746366075271,
        "2.1.1.2->2.1.1.2": 0.12577636805553444,
        "2.1.1.2->2.1.2.1": 0.009790370401301242,
        "2.1.1.2->2.1.2.2": 0.015849023258956246,
        "2.1.1.3->2.1.1.3": 0.0,
        "2.1.2.0->2.1.2.0": 0.02567979666453066,
        "2.1.2.1->2.0.2.1": 0.008552899295877357,
        "2.1.2.1->2.1.2.0": 0.00693717564044031,
        "2.1.2.1->2.1.2.1": 0.16244230529798212,
        "2.1.2.2->2.1.2.2": 0.019977440517546317,
        "2.2.0.2->2.2.0.2": 0.0,
        "2.2.1.0->2.2.1.0": 0.0,
        "2.2.1.1->2.2.1.1": 0.04553218766661734,
        "2.2.1.2->2.2.1.2": 0.0017028390728565895,
        "2.2.2.1->2.2.2.1": 0.08303285354972213,
        "2.2.2.2->2.2.1.2": 0.0026078573854007724,
        "2.2.2.2->2.2.2.2": 0.003245262301306802,
        "3.1.1.1->3.1.1.1": 0.0
      }
    },
    "scarcity": {
      "abundanceTurnoverProfile": {
        "0.0.1.1": 0.029562475364603862,
        "1.0.0.1": 0.24852114758947058,
        "1.0.1.1": 1.1554301574269548,
        "1.0.1.2": 0.44287600064180255,
        "1.0.2.1": 0.8670651249015069,
        "1.0.2.2": 0.8169669507059377,
        "1.1.0.1": 0.6800567606766283,
        "1.1.0.2": 0.5812985035303732,
        "1.1.1.0": 0.17454966195777444,
        "1.1.1.1": 4.408075289828328,
        "1.1.1.2": 1.9004916105475358,
        "1.1.2.0": 0.08243580507731452,
        "1.1.2.1": 1.0996268023749982,
        "1.1.2.2": 0.9738593816615863,
        "1.2.1.0": 0.06640211640211639,
        "1.2.1.1": 0.5471159111030653,
        "1.2.1.2": 0.10901117310835523,
        "1.2.1.3": 0.018518518518518517,
        "1.2.2.1": 0.1260405172169878,
        "1.2.2.2": 0.12295092491635728,
        "2.0.1.1": 0.41374107649501596,
        "2.0.1.2": 0.19117647058823528,
        "2.0.2.1": 0.12626262626262627,
        "2.1.0.0": 0.22241055090946907,
        "2.1.0.1": 1.3439090640694125,
        "2.1.0.2": 1.058469926665012,
        "2.1.1.0": 0.8963469473481537,
        "2.1.1.1": 12.680460972400914,
        "2.1.1.2": 6.2496672930051504,
        "2.1.1.3": 0.07876535229476406,
        "2.1.2.0": 0.016937669376693776,
        "2.1.2.1": 4.659911024604709,
        "2.1.2.2": 1.340627397891153,
        "2.2.0.2": 0.18359735863046778,
        "2.2.1.0": 0.3163841807909604,
        "2.2.1.1": 1.2142394380424641,
        "2.2.1.2": 0.3894594277408412,
        "2.2.2.1": 1.0920027035197337,
        "2.2.2.2": 0.52985163682908,
        "3.1.1.1": 0.11693989071038251,
        "3.2.2.1": 0.41960784313725497
      },
      "cellFluxProfile": {
        "0.0.1.1": 0.0,
        "1.0.0.1": 0.00045978748951977847,
        "1.0.1.1": 0.013954993474824887,
        "1.0.1.2": 0.015377378832511276,
        "1.0.2.1": 0.035733807945971266,
        "1.0.2.2": 0.0341641856878833,
        "1.1.0.1": 0.010997993006770596,
        "1.1.0.2": 0.008515621196165009,
        "1.1.1.0": 0.0020692499180565834,
        "1.1.1.1": 0.05833489687808119,
        "1.1.1.2": 0.019476182393701347,
        "1.1.2.0": 0.0,
        "1.1.2.1": 0.007766517985816539,
        "1.1.2.2": 0.01123617904709931,
        "1.2.1.0": 0.0,
        "1.2.1.1": 0.0024344715863736373,
        "1.2.1.2": 0.0,
        "1.2.1.3": 0.0,
        "1.2.2.1": 0.0,
        "1.2.2.2": 0.0008384408861720096,
        "2.0.1.1": 0.01638289451443075,
        "2.0.1.2": 0.0,
        "2.0.2.1": 0.0,
        "2.1.0.0": 0.006260749953640687,
        "2.1.0.1": 0.019092618727200368,
        "2.1.0.2": 0.02078839614445331,
        "2.1.1.0": 0.009041893010530627,
        "2.1.1.1": 0.3130132223936187,
        "2.1.1.2": 0.16351637441386532,
        "2.1.1.3": 0.0,
        "2.1.2.0": 0.0,
        "2.1.2.1": 0.11788667048669127,
        "2.1.2.2": 0.009972320614526822,
        "2.2.0.2": 0.006672702586422084,
        "2.2.1.0": 0.0,
        "2.2.1.1": 0.014703470923397126,
        "2.2.1.2": 0.0021589027082305734,
        "2.2.2.1": 0.02624414361472483,
        "2.2.2.2": 0.00901189626978469,
        "3.1.1.1": 0.0,
        "3.2.2.1": 0.006439371706406827
      },
      "edgeFluxProfile": {
        "0.0.1.1->0.0.1.1": 0.0,
        "1.0.0.1->1.0.0.1": 0.00045978748951977847,
        "1.0.1.1->1.0.0.1": 0.0012009764218682475,
        "1.0.1.1->1.0.1.1": 0.009338692331019652,
        "1.0.1.1->2.0.1.1": 0.0022006229463404038,
        "1.0.1.2->1.0.1.2": 0.01148130200103126,
        "1.0.1.2->2.0.1.2": 0.0038960768314800142,
        "1.0.2.1->1.0.2.1": 0.035733807945971266,
        "1.0.2.2->1.0.2.2": 0.02713655324535094,